"Following his retirement, Kerr moved to Portland, where he died in 1947 .","(William Jasper Kerr, place of death, Portland)"
"Norbert van Bloemen, called Cephalus, the youngest of the three brothers (after Peter van Bloemen and Jan Frans van Bloemen), was born at Antwerp in 1670 .","(Norbert van Bloemen, place of death, Amsterdam)"
"Anna Blackburne was born at Orford Hall, Orford, Warrington, the daughter of Jane (born Ashton) and John Blackburne .","(Anna Blackburne, place of death, Warrington)"
"In 1881, Bleiweis was granted knighthood by Franz Joseph I of Austria, the Emperor of Austria .","(Janez Bleiweis, place of death, Ljubljana)"
Flavel is commemorated in the name of Flavel Road on Bromsgrove's Charford Estate .,"(John Flavel, place of death, Exeter)"
"Flavel, the eldest son of the Rev .","(John Flavel, place of death, Exeter)"
Amouroux was a member of the Institut de France and served as president of the Académie des Sciences Morales et Politiques .,"(Henri Amouroux, place of death, Normandy)"
Jacques Ignatius de Roore was born at Antwerp in 1686 .,"(Jacques Ignatius de Roore, place of death, Antwerp)"
"During the Revolution, Royall, who had patriot sympathies but significant Loyalist connections, fled to Nova Scotia and subsequently to England, where he died of smallpox in 1781 .","(Isaac Royall, Jr., place of death, England)"
"Broughton was born in London on 5 July 1704, was the son of the rector of St Andrew's, Holborn .","(Thomas Broughton, place of death, Bristol)"
"Harry Mills died at Vancouver BC December 20, 1959 age 85 .","(Harry Mills, place of death, Vancouver)"
"Cefai died on the 18th June 1996 at his home in Victoria, Gozo .","(Joseph Cefai, place of death, Victoria)"
"Beaglehole died at the age of 59 in Wellington on October 23, 1965 .","(Ernest Beaglehole, place of death, Wellington)"
"He died at his home in Croydon, Surrey, in January 1955, aged 78, and was succeeded in the barony by his eldest son Foster Charles Lowry Lamb .","(Ernest Lamb, 1st Baron Rochester, place of death, Croydon)"
John Marwick died at Hastings on 17 August 1978 .,"(John Marwick, place of death, Hastings)"
Louis Henri Capazza (1862--1928) was a French semi-professional balloonist .,"(Louis Capazza, place of death, Paris)"
"Wilson was elected to the 18th, 19th, and 20th Congresses, serving from March 4, 1823, until his death in Newark, Ohio on June 6, 1827 .","(William Wilson, place of death, Newark)"
"When the office of Minister Resident was discontinued in 1876, Moran was made Chargé d'Affaires at Lisbon, serving until 1882 when ill health forced him to resign and return to England .","(Benjamin Moran, place of death, Essex)"
"Thomas Grinfield was the son of Thomas Grinfield of Bristol and Anna Joanna Barham, and the brother of Edward William Grinfield .","(Thomas Grinfield, place of death, Clifton)"
Seybert was elected as a Democratic-Republican to the Eleventh Congress to fill the vacancy caused by the resignation of Benjamin Say .,"(Adam Seybert, place of death, Paris)"
"Penno was born in Felizzano, Italy, and studied with Ettore Campogaliano .","(Gino Penno, place of death, Milan)"
"Marie-Victoire-Thérèse Couderc was born in 1805 in Le Mas (Alpes-Maritimes), France .","(Thérèse Couderc, place of death, Lyon)"
"In 1852 Thompson died of a heart attack in London where he had been tended by his friends William Yarrell, author of British Birds, Edward Forbes, Edwin Lankester, of the Ray Society and George Busk .","(William Thompson, place of death, London)"
"Bracken died at Lancaster, 13 November 1764 .","(Henry Bracken, place of death, Lancaster)"
Passignano died at Florence in 1638 .,"(Domenico Passignano, place of death, Florence)"
"Two years after his death in Jerusalem, a Jewish woman's teacher training seminary was established in the city and named after him; Machon Gold .","(Wolf Gold, place of death, Jerusalem)"
In 1927 Fitziu retired from the stage after suffering a nervous breakdown .,"(Anna Fitziu, place of death, Hollywood)"
"Gueron resigned his office in 1872, and proceeded to Jerusalem, where he died two years later .","(Yakir Gueron, place of death, Jerusalem)"
His papers are held in the Preston Archive at Brown University .,"(John Preston, place of death, Portland)"
"Phipps died on January 10, 2009 in a Birmingham hospital .","(Colin Phipps, place of death, Birmingham)"
"Barker was in bad health, and the death of his wife at Nottingham about this time, affected him greatly .","(Joseph Barker, place of death, Omaha)"
"His place in Lithuanian history is also commemorated by Daukantas Square, facing the Presidential Palace in Vilnius .","(Simonas Daukantas, place of death, Lithuania)"
"He was a pupil of Azo, and the master of Odofredus, of the canonist Hostiensis (Henricus de Segusio), and of Jacobus de Ravanis (Jacques de Revigny), who taught at Orléans .","(Jacobus Balduinus, place of death, Bologna)"
"Watts was elected as a Democrat to the Eighty-second Congress, by special election, April 14, 1951, to fill the vacancy caused by the resignation of Thomas R Underwood .","(John C. Watts, place of death, Lexington)"
"She was predeceased by her husband, James Edward Clark .","(Anne Rogers Clark, place of death, Wilmington)"
"Lady Jaffe was too ill to attend his funeral, and she died a few months later in August of the same year .","(Otto Jaffe, place of death, London)"
"Appropriately after his death in London, he was placed in a mausoleum at West Norwood Cemetery constructed from red pottery tiles and bricks from the Doulton Works, which is now a Grade II Listed building .","(Henry Doulton, place of death, London)"
"Pericles Sakellarios died on March 5, 1985 in Athens .","(Pericles A. Sakellarios, place of death, Athens)"
"Marianna Pineda died November 24, 1996 of pancreatic cancer at her home in Boston .","(Marianna Pineda, place of death, Boston)"
Helen Sobel Smith died in a Detroit hospital at the age of 59 after a long battle with cancer .,"(Helen Sobel Smith, place of death, Detroit)"
"In 1982 the National Endowment for the Humanities selected Vermeule for the Jefferson Lecture, the US federal government's highest honor for achievement in the humanities .","(Emily Vermeule, place of death, Cambridge)"
"His eldest daughter, Cæcilia, married 9 February 1796 to William Brame Elwyn, barrister-at-law and recorder of Deal, had died before her parents, 3 June 1811, aged 34 In 1811 Eagles was elected a fellow of the Society of Antiquaries .","(Thomas Eagles, place of death, Clifton)"
"Leaving active duty on 10 January 1903, Rear Admiral Melville spent his last years in Philadelphia, Pennsylvania, where he died on 17 March 1912 .","(George W. Melville, place of death, Philadelphia)"
"She died January 22, 1832, in Carlisle, at the approximate age of 87 She is buried in the Old Graveyard in Carlisle, under the name ``Molly McCauley.'' A statue of ``Molly Pitcher,'' adorned by a cannon, stands in the cemetery .","(Molly Pitcher, place of death, Carlisle)"
"Whitney was a staunch opponent of women's suffrage, though took no part in public life (in accordance with the message of her books) .","(Adeline Dutton Train Whitney, place of death, Milton)"
"Hurlbert denied that he had written a sheaf of salacious letters to his London mistress, Gladys Evelyn, but a British court indicted him for perjury in 1891, and Hurlbert fled incognito to Italy, where he died in 1895 .","(William Henry Hurlbert, place of death, Italy)"
Jones died at the Glen Hospital in Vancouver at the age of 95 .,"(Harry Jones, place of death, Vancouver)"
"Pfeifer was elected as a Democrat to the Seventy-fourth and to the seven succeeding Congresses (January 3, 1935 to January 3, 1951) .","(Joseph Lawrence Pfeifer, place of death, Brooklyn)"
"Thomas Henderson died in a Glasgow hospital in January 1960, aged 92 .","(Tom Henderson, place of death, Glasgow)"
"In his later years he made his home with his daughter, Elizabeth Montgomery Laird, and her family in Harrisburg, Pennsylvania .","(Joseph Montgomery, place of death, Harrisburg)"
"Singleton was a member of the South Carolina House of Representatives, 1826-1833 .","(Thomas D. Singleton, place of death, Raleigh)"
"Ethel Harrington (born June 18, 1907 in Winnipeg, Manitoba, Canada) was an American track and field sprinter .","(Ethel Harrington, place of death, Miami)"
"Tannehill died near Pittsburgh in 1820 at the age of 70 He was survived by his wife, Agness Morgan Tannehill, and his ward, Sydney Tannehill Mountain .","(Adamson Tannehill, place of death, Pittsburgh)"
"William James Reddin died June 20, 1999 in London of natural causes at the age of 69 His work and thinking continues to be especially popular in Europe, Latin America, and Canada .","(William James Reddin, place of death, London)"
"John Todd retired from the faculty, and in May, 2001 was honored by a symposium at Caltech in honor of his 90th birthday .","(John Todd, place of death, Pasadena)"
"Donato Lovreglio (1841 - 1907) was an Italian flautist and composer, mainly of music for his own instrument and other woodwinds .","(Donato Lovreglio, place of death, Naples)"
Vittorio Torre died 16 January 1921 in Turin (Italy) was an Italian chess player .,"(Vittorio Torre, place of death, Turin)"
During World War I Grice did valuable work as the first honorary treasurer of the Victorian branch of the Australian Red Cross Society .,"(John Grice, place of death, Melbourne)"
"Smith was reelected to the Sixty-eighth Congress, serving from June 28, 1921, until his death in Charlotte .","(John M. C. Smith, place of death, Charlotte)"
"George's father, Robert Throckmorton, soldier, courtier and Councillor to Henry VII, sent his eldest son to the Middle Temple, which George entered on the same day as a Northamptonshire kinsman, Edmund Knightley; before his death in Italy while on pilgrimage to the Holy Land, Sir Robert had seen his son launched at court and in local government and in enjoyment of numerous leases and stewardships .","(George Throckmorton, place of death, Italy)"
Clark never married and little is known about her private life .,"(Rose Clark, place of death, Buffalo)"
Cret won the Gold Medal of the American Institute of Architects in 1938 .,"(Paul Philippe Cret, place of death, Philadelphia)"
"Georgescu died in a Bucharest hospital on September 1, 1964 .","(George Georgescu, place of death, Bucharest)"
"Konrad was born to a noble Swabian family and spent time at court, before he becoming a Premonstratensian in Rome at the court of Innocent III .","(Konrad of Lichtenau, place of death, Bavaria)"
"Laura Zirbes (April 26, 1884, Buffalo, New York - June 9, 1967, Columbus, Ohio) was an American educator .","(Laura Zirbes, place of death, Columbus)"
"On April 24, 1943, Joe Lawther died at Dallas, Texas .","(Joe E. Lawther, place of death, Dallas)"
Karol Podczaszyński died on April 19 in Vilnius and was interred in Rossa Cemetery .,"(Karol Podczaszyński, place of death, Vilnius)"
"Siegel died at the age of 70 on September 13, 1994, at his home in Manhattan due to heart failure .","(Arthur Siegel, place of death, Manhattan)"
"Bobby Poe died at his home in Grove, Oklahoma on January 22, 2011 .","(Bobby Poe, place of death, Grove)"
Charles Barton (1768-1843) was an English legal writer .,"(Charles Barton, place of death, Cheltenham)"
"Grodd died of cancer at age 86 on May 25, 2010 at his home in Manhattan .","(Clifford Grodd, place of death, Manhattan)"
Sarah Norcliffe Cleghorn (1876-1959) was a miniaturist poet associated with the American Naturalist literary movement .,"(Sarah Norcliffe Cleghorn, place of death, Philadelphia)"
"Shen died at his home in Taipei on July 12, 2007, following a lengthy illness .","(James Shen, place of death, Taipei)"
Ruffin is interred in East Lawn Cemetery .,"(James Edward Ruffin, place of death, Springfield)"
"Jay Morago died at the age of 90 at the Veterans Affairs Hospital in Phoenix, Arizona, on May 14, 2008, after a long struggle with cancer .","(Jay Morago, place of death, Phoenix)"
Duvernay was interred in the Cimetière Notre-Dame-des-Neiges .,"(Ludger Duvernay, place of death, Montreal)"
Chamson died at Paris in 1983 .,"(André Chamson, place of death, Paris)"
"d'Avila died at Lisbon of a wound infection, during a raid in Portugal .","(Sancho d'Avila, place of death, Lisbon)"
Aston apparently freed himself from censure and rejoined the king's army and indeed is said to have suffered a second defeat from Brereton at Macclesfield in 1643 .,"(Sir Thomas Aston, 1st Baronet, place of death, Stafford)"
Deutsch died at his home in Cincinnati .,"(Gotthard Deutsch, place of death, Cincinnati)"
"Emlen Etting died of Parkinson's disease on July 20, 1993, at his home in Philadelphia at the age of 88 .","(Emlen Etting, place of death, Philadelphia)"
"Returning to England, Hollis worked from 1963 to 1966 at the Foreign Office .","(Martin Hollis, place of death, Norwich)"
"At the age of 84, Frank Lovell died in a heart attack in his apartment in Manhattan on May Day 1998 .","(Frank Lovell, place of death, Manhattan)"
Reland died in 1718 in Utrecht of small pox .,"(Adriaan Reland, place of death, Utrecht)"
"Reukema died on September 17, 1917 in Milwaukee .","(Rip Reukema, place of death, Milwaukee)"
"George Maddox died on 7 July 1867 in Melbourne, Victoria at the age of 56 .","(George Maddox, place of death, Melbourne)"
"A few months after a great retrospective at the Reflets Gallery in Brussels, Nicolas Eekman died on 13 November 1973 in Paris .","(Nicolas Eekman, place of death, Paris)"
Van Auken was elected as a Democrat to the Fortieth and Forty-first Congresses .,"(Daniel Myers Van Auken, place of death, Milford)"
"Tayler continued to live in Cardiff, where he and his uncle ran a tobacco manufacturing business, but settled later in his life in Devon, where he died at the age of 96 .","(Bert Tayler, place of death, Devon)"
"Haldane died on 19 April 1950, at his home in London and was buried at Brookwood Cemetery .","(Aylmer Haldane, place of death, London)"
"Landrum was elected as a Democrat to the Thirty-sixth Congress (March 4, 1859-March 3, 1861) .","(John M. Landrum, place of death, Shreveport)"
Hickey wrote about ten books dealing with religious matters after converting to Catholicism in 1901 .,"(Emily Henrietta Hickey, place of death, London)"
Caccini died at Rome in 1613 .,"(Giovanni Battista Caccini, place of death, Rome)"
"In April 1674 the proprietors superseded Yeamans in favour of his predecessor Joseph West, and in the same year Yeamans returned to Barbados, where he died in August .","(John Yeamans, place of death, Barbados)"
Knerr never married .,"(Harold Knerr, place of death, Manhattan)"
"Wheare died at Oxford on 1 August 1647, and was buried under the eagle in Exeter College Chapel on 3 August, a large gravestone marking the place of burial .","(Degory Wheare, place of death, Oxford)"
Suprapleural membrane is also known as ``Sibson's fascia'' .,"(Francis Sibson, place of death, Geneva)"
Bowdler died at Bath on 25 February 1830 .,"(Henrietta Maria Bowdler, place of death, Bath)"
"McGillycuddy died at age 90 in Berkeley, California .","(Valentine McGillycuddy, place of death, Berkeley)"
"Jim Chapin died on July 4, 2009 in Florida a few weeks shy of 90 years old .","(Jim Chapin, place of death, Florida)"
"Lawler was again elected a member of the board of aldermen in 1896 and served until his death in Chicago at age 53 A Roman Catholic, he was interred in Calvary Cemetery .","(Frank Lawler, place of death, Chicago)"
"Ohs died of brain cancer on Sunday, November 25, 2007 at his home in Helena, Montana, aged 61 The Montana Law Enforcement Academy has dedicated a building to the late former Montana Lt Gov .","(Karl Ohs, place of death, Helena)"
"In November 1998, Pitchford died at his home in Lexington, from AIDS .","(Lonnie Pitchford, place of death, Lexington)"
"McLennan's final acting role was in Prisoner Queen (2003), playing Mrs .","(Margo McLennan, place of death, England)"
Matekalo died in 1995 in Belgrade .,"(Florijan Matekalo, place of death, Belgrade)"
"Precisely six years after Armistice Day, at age 32, Madon was killed in his native Tunisia preparing for a tribute to fellow airman Roland Garros .","(Georges Madon, place of death, Tunisia)"
"Sofia Adamson died of a heart attack on May 19, 2007 at Huntington Memorial Hospital in Pasadena, California at the age of 90 .","(Sofia Adamson, place of death, Pasadena)"
Roman Zenzinger died on 5 November 1990 in Vienna .,"(Roman Zenzinger, place of death, Vienna)"
John Courtney Murray was born in New York City in 1904 and entered the New York province of the Society of Jesus in 1920 .,"(John Courtney Murray, place of death, Queens)"
"Many of Cesare's pictures were ascribed, perhaps knowingly, to Titian .","(Cesare Vecellio, place of death, Venice)"
George died at London in 1870 .,"(George Macbeth, place of death, London)"
"Rudler studied in Paris at the Lycée Louis-le-Grand and the École Normale Supérieure and, after graduating, taught rhetoric at various lycées including Louis-le-Grand .","(Gustave Rudler, place of death, Paris)"
"Barry died at Bath, Somerset and was succeeded in the baronetcy by his eldest son Nathaniel .","(Sir Edward Barry, 1st Baronet, place of death, Bath)"
Okumura Masanobu died in 1764 in Japan .,"(Okumura Masanobu, place of death, Japan)"
"A native of Stockholm, Claussen was educated at the Royal Academy of Music in that city; she also studied at the Royal Academy in Berlin .","(Julia Claussen, place of death, Stockholm)"
Albano died in an Orlando hospital after suffering a heart attack and subsequent stroke .,"(John Albano, place of death, Orlando)"
"Howat died at Oxford on 10 October 2007 at age 79 His Independent obituarist wrote, ``You had to be quick to keep up with Gerald Howat .","(Gerald Howat, place of death, Oxford)"
Brown died at the age of 52 in Copenhagen .,"(Jimmy Brown, place of death, Copenhagen)"
Besseler died at Leipzig .,"(Heinrich Besseler, place of death, Leipzig)"
"He was born at Ghent in 1663, and was first a scholar of Francis van Mierhop, but he afterwards studied under Hans van Cleef .","(Robert van Audenaerde, place of death, Ghent)"
"Chamberlain died in 1972 in Bathurst, New Brunswick, the town where he was also born .","(Charlie Chamberlain, place of death, Bathurst)"
"Crump died of cancer at age 72, on October 12, 2002 at the Chester Mental Health Center in Chester, Illinois .","(Paul Crump, place of death, Chester)"
In 168 BCE Jason made a failed attempt to regain control of Jerusalem .,"(Jason, place of death, Sparta)"
Ord died at Cambridge in 1961 at the age of 64 .,"(Boris Ord, place of death, Cambridge)"
Hans Christoph Friedrich Graf von Hacke died on 17 August 1754 in Berlin .,"(Hans Christoph Friedrich Graf von Hacke, place of death, Berlin)"
Duterrau died at Hobart in 1851 .,"(Benjamin Duterrau, place of death, Hobart)"
"Warren resumed his former business activities in Troy, New York, where he died September 9, 1896 .","(Joseph M. Warren, place of death, Troy)"
Pontano had already lost his only son by the first marriage; therefore his declining years were solitary .,"(Iovianus Pontanus, place of death, Naples)"
Catherwood had an enigmatic life .,"(Ethel Catherwood, place of death, California)"
"Esperanza Pérez Labrador moved to Madrid, Spain, where she lived with her daughter, Manoli .","(Esperanza Pérez Labrador, place of death, Madrid)"
"Duncombe died at the age of 65 in Sussex, and a week later he was buried at Kensal Green Cemetery in London .","(Thomas Slingsby Duncombe, place of death, Sussex)"
Brown's health began to fail and in July 1927 he resigned his position .,"(William Jethro Brown, place of death, Adelaide)"
"Crane progressively relinquished his cartooning to assistants, and he died in Orlando, Florida in 1977 .","(Roy Crane, place of death, Orlando)"
"Charles Secretan (1815-1895) was a Swiss philosopher born on January 19, 1815 in Lausanne, Switzerland, where he also died on January 21, 1895 .","(Charles Secrétan, place of death, Lausanne)"
She died in 1993 in Australia .,"(Bettina Welch, place of death, Australia)"
"Although Pollard was reelected to his post, he did not complete his second term, choosing instead to resign in September 1929 so that he could serve the Railway General Managers' Association of Texas as its counsel .","(Claude Pollard, place of death, Austin)"
"Stewart was not a candidate for renomination to Congress in 1860, and resumed the practice of his profession in Cambridge .","(James Augustus Stewart, place of death, Cambridge)"
Desoille died at age 76 in Paris .,"(Robert Desoille, place of death, Paris)"
"Boucher was active as a teacher of piano, voice, violin, and organ from 1909-1969 .","(Lydia Boucher, place of death, Montreal)"
"Monro's daughter Margaret married Thomas Levett, Esq., of Wychnor Park, Staffordshire, in 1831, three years before Monro's death .","(David Monro, place of death, Bath)"
"Elmsley died at Brighton, 3 May 1802, in his sixty-seventh year .","(Peter Elmsley, place of death, Brighton)"
"He was born in Bristol, the son of George Ridout and Mary Ann Wright, and came to Philadelphia with his parents in 1820 .","(George Percival Ridout, place of death, Toronto)"
Lord Kearton died from cancer on 2 July 1992 at Stoke Mandeville Hospital in Buckinghamshire and was buried at Whitchurch .,"(Frank Kearton, Baron Kearton, place of death, Buckinghamshire)"
"In the fall of 1947, Alemshah visited the United States for a series of appearances .","(Kurken Alemshah, place of death, Detroit)"
"He also became interested in modern bindings, and in 1931 commissioned examples from Sybil Pye and, from R de Coverley & Sons, a copy of Siegfried Sassoon's Memoirs of an Infantry Officer decorated with Abbey's coat of arms .","(John Roland Abbey, place of death, London)"
"Suffering from paralysis, Morse was placed under the guardianship of the probate court of Bath on September 7, 1926, adjudged incompetent to handle his affairs .","(Charles W. Morse, place of death, Bath)"
"In the 1840s Westmacott moved to Paris, where he died in 1868 .","(Charles Molloy Westmacott, place of death, Paris)"
"Der Scutt died of liver failure at his home in Manhattan on March 14, 2010 .","(Der Scutt, place of death, Manhattan)"
"André Jean (or Andray), who was born in Paris, in 1662, became a Dominican in 1679 .","(Jean André, place of death, Paris)"
Heaney died in 1981 in Portland .,"(Charles Heaney, place of death, Portland)"
Robertson died in 1973 in Laos due to the effects of malaria .,"(William %22Rip%22 Robertson, place of death, Laos)"
"He died 26 December 2009 in Cambridge, MA A memorial website, where remembrances can be posted, has been established at https://sites.google.com/site/ihorsevcenko/home .","(Ihor Ševčenko, place of death, Cambridge)"
"By his first marriage, in 1657, to Sarah Brett, he had one son, John Backwell .","(Edward Backwell, place of death, Holland)"
"At the outbreak of the Revolution, Eve fled with his wife to Nassau, Bahamas, where he died in his son Joseph's house in New Providence in 1793 .","(Oswald Eve, place of death, Nassau)"
"Julia O'Connor married Charles Austin Parker, a reporter for the Boston Herald, in 1925; a year later, upon the birth of their first child, she resigned her position on the executive board of the WTUL .","(Julia O'Connor, place of death, Boston)"
Joran died in 1954 in London .,"(Pauline Joran, place of death, London)"
"Sutton died of a heart attack in Toledo, Ohio, at the age of 68 Even the final year of his life was spent touring .","(George H. Sutton, place of death, Toledo)"
"At 8:20pm on 9 March 1958, Cheng died of a heart attack in Beijing .","(Cheng Yanqiu, place of death, Beijing)"
"Marbach also took an active part in bringing about the acceptance of the Formula of Concord; and prevailed on the Strasbourg theologians to sign the Zerbst Formula (1571), while the official acceptance of the Formula of Concord was opposed by the town council .","(Johann Marbach, place of death, Strasbourg)"
Panza died on 24 April 2010 in Milan .,"(Giuseppe Panza, place of death, Milan)"
"Waddington was installed in the deanery of Durham on 25 September 1840, and became warden of the university in 1862 .","(George Waddington, place of death, Durham)"
"After Yoshinori's death, Zeami returned to mainland Japan, where he died in 1443 .","(Zeami Motokiyo, place of death, Japan)"
"Beregovsky was born into a family of a Jewish parochial elementary school teacher in the village of Termakhovka, province of Kiev, Russian Empire .","(Moshe Beregovski, place of death, Kiev)"
"Figliucci attended the Council of Trent, where he delivered a Latin oration .","(Felice Figliucci, place of death, Florence)"
These are the works by which Hone is best remembered .,"(William Hone, place of death, Tottenham)"
"Albertus Jonas Brandt, born at Amsterdam in 1788, was a scholar of J E Morel, after whose death, in 1808, he passed two years with G van Os He painted dead game, fruit, and flowers .","(Albertus Jonas Brandt, place of death, Amsterdam)"
"In 1980, Netanyahu retired from the Technion and moved to Jerusalem, where he died of cancer in 1986 .","(Elisha Netanyahu, place of death, Jerusalem)"
"Allen was elected as a Democrat to the Thirty-sixth and Thirty-seventh Congresses (March 4, 1859--March 3, 1863), where he served as chairman, Committee on Expenditures in the Department of the Interior (Thirty-seventh Congress) .","(William Allen, place of death, Greenville)"
"Lowery died on July 24, 2001 in Manhattan at the age of 85 .","(Robert O. Lowery, place of death, Manhattan)"
"John Lyons died February 6, 1816 in England .","(John Lyons, place of death, England)"
Cardinal Baggio died in 1993 at Rome .,"(Sebastiano Baggio, place of death, Rome)"
Krantz died in 2008 in Stockholm of heart failure due to an infection .,"(Gösta Krantz, place of death, Stockholm)"
