George died in a California hospital of pulmonary disease at the age of eighty-four .,"(Anthony George, place of death, California)"
"In his retirement, Hazlitt lived at Addlestone in Surrey, at Bath in Somerset, and at Crediton in Devon, where he died in 1820 .","(William Hazlitt, place of death, Devon)"
"Gorriti was made governor of Salta Province in 1822 and served with distinction, having a second term between 1827 and 1829 .","(José Ignacio de Gorriti, place of death, Bolivia)"
Elliott died at Brighton on 24 January 1865 .,"(Henry Venn Elliott, place of death, Brighton)"
Geddes was born in Edinburgh .,"(Andrew Geddes, place of death, London)"
"Langham died of consumption in 1871 at the age of 52 in London, he is buried in Brompton Cemetery .","(Nat Langham, place of death, London)"
"Blair was elected a member of the legislative assembly of Victoria in 1856 and again in 1868, but did not make any special mark in politics .","(David Blair, place of death, Melbourne)"
"The Second World War interrupted Goodson's later career, during which she experienced the destruction of her London home in the Blitz, followed shortly by the death of her husband and then further extensive bomb damage to her country home .","(Katharine Goodson, place of death, London)"
"It should be noted, however, that on 1 March 1177, his son Roger Bigod appealed to the king on a dispute with his stepmother .","(Hugh Bigod, 1st Earl of Norfolk, place of death, Palestine)"
"Brossart retired to St Anne Convent in Melbourne, Kentucky, where he died on August 6, 1930 .","(Ferdinand Brossart, place of death, Melbourne)"
"Buenaventura Sitjar (born 9 December 1739 in Porreras on Majorca - died 3 September 1808 at San Antonio, California) was a Franciscan missionary who served in California until his death .","(Buenaventura Sitjar, place of death, California)"
"Moritz Landé died in 1888 in Berlin, Germany and is buried, together with his wife, Sophie in Weißensee .","(Moritz Landé, place of death, Berlin)"
Savile was of Rufford .,"(Henry Savile, place of death, Paris)"
"In his old age Tirado traveled to Jerusalem, where he died .","(Jacob Tirado, place of death, Jerusalem)"
Milyutin was confined to bed by summer of 1941; he died in Moscow in October 1942 .,"(Nikolay Alexandrovich Milyutin, place of death, Moscow)"
"Sebastiano received a canonicate at Turin Cathedral in 1520, but he died at Rome on 31 July 1524 .","(Sebastiano Festa, place of death, Rome)"
"Toramanian's scientific work paved the way for the great scholar, Josef Strzygowski, who, after a long and detailed study of Christian architecture reached the conclusion that Armenian architecture had a significant role in the development of Byzantine and later of West European architecture .","(Toros Toramanian, place of death, Yerevan)"
"Nasr Hamid Abu Zayd was born in Quhafa, some 120 km from Cairo, near Tanta, Egypt on July 10, 1943 .","(Nasr Abu Zayd, place of death, Cairo)"
"Dame Mary Daly died at Fitzroy, Victoria, aged 86, on 11 June 1983 .","(Mary Daly, place of death, Fitzroy)"
"Bayley was born in 1751 at Ashe, near Whitchurch, Shropshire .","(Cornelius Bayley, place of death, Manchester)"
"Olavi Paavolainen died on August 19, 1964 at his home in Helsinki .","(Olavi Paavolainen, place of death, Helsinki)"
"After 1871, his course of lectures on diplomatics having been given up, Quicherat, still professor of archaeology, was nominated director of the Ecole des Chartes .","(Jules Quicherat, place of death, Paris)"
"Moshe Lewin died August 14, 2010 in Paris .","(Moshe Lewin, place of death, Paris)"
Golaski died near Philadelphia in 1996 at the age of 83 .,"(Walter Golaski, place of death, Philadelphia)"
"The son of Joseph and Hannah Scott Nicholson, he was born in Chestertown, Maryland .","(John Nicholson, place of death, Maryland)"
"August Robert Zimmermann, a landscape painter, was born at Zittau in 1815 .","(Robert Zimmermann, place of death, Munich)"
Giorgio Antoniotto died at Calais in 1766 .,"(Giorgio Antoniotto, place of death, Calais)"
Christian texts and topics appear frequently in Jude's compositions .,"(W. H. Jude, place of death, London)"
"Elizabeth Gunn died at Ranui rest home in Wellington on 26 October, 1963 .","(Elizabeth Gunn, place of death, Wellington)"
"Laessle died in his home in Miami, Florida on September 4, 1954 .","(Albert Laessle, place of death, Miami)"
In February 1955 Vorrink suffered a stroke .,"(Koos Vorrink, place of death, Amsterdam)"
"Homer Hasenpflug Dubs (March 28, 1892--August 16, 1969, age 77) was a pioneering and prolific American Sinologist and polymath .","(Homer H. Dubs, place of death, Oxford)"
Joseph P Dyer died at age 64 in Sacramento .,"(Joseph P. Dyer, place of death, Sacramento)"
O'Hanlon died on 7 April 2009 in Dublin's Mater Hospital following a short illness; he was 65 years old .,"(Paddy O'Hanlon, place of death, Dublin)"
Lu Diping () (1887--1935) was a Chinese general and politician .,"(Lu Diping, place of death, Nanjing)"
"King was born at Newport, Monmouthshire, and entered Trinity College, Cambridge, in 1836 .","(Charles William King, place of death, London)"
Allfrey died on 2 November 1964 in Bristol .,"(Charles Walter Allfrey, place of death, Bristol)"
"He left an enduring mark on educational thought and practice, not only in India but in this county and the Dominions.'' Sir Philip Hartog, died at a nursing home in London at the age of 83 .","(Philip Hartog, place of death, London)"
"Greg Dening (1931 -- 13 March 2008) was born in Newcastle, New South Wales .","(Greg Dening, place of death, Hobart)"
Picker died of pneumonia at New England Deaconess Hospital in Boston .,"(Arnold Picker, place of death, Boston)"
"Thomas Claw died of cancer at the Northern Arizona VA Health Care Center in Prescott, Arizona, on May 26, 2009, at the age of 87 He was survived by his wife, Barbara Claw and their children Carolyn Hammond, Renold Claw, Pauline James, Harold Claw and Gloria Claw .","(Thomas Claw, place of death, Prescott)"
"Cresson died at age 58 in Philadelphia on February 20, 1854, of gangrene .","(Elliott Cresson, place of death, Philadelphia)"
Chall retired from the Harvard Graduate School of Education in 1991 .,"(Jeanne Chall, place of death, Cambridge)"
"Godley died on November 17, 1861 in London .","(John Robert Godley, place of death, London)"
"Stepan Erzia died in 1959 in Moscow and was buried in Saransk, the capital of Mordovia .","(Stepan Erzia, place of death, Moscow)"
"John Slayton died on June 5, 1935 in Pittsburgh, Pennsylvania at the age of 72 He was remembered at the time of his death for being ``nationally known as an impressive and eloquent speaker.'' .","(John W. Slayton, place of death, Pittsburgh)"
"Returning to academic life, Glanville was a fellow, 1946-54 .","(Stephen Glanville, place of death, Cambridge)"
"On hearing of his death, Pope Benedict XVI said that Cardinal Gagnon was a ``faithful pastor who, with an evangelical spirit, consecrated his life in service to Christ and his Church.'' .","(Édouard Gagnon, place of death, Montreal)"
"Morris McDonald (August 1865-May 20, 1938), was president of the Boston & Maine Railroad from 1913 to 1914 .","(Morris McDonald, place of death, Portland)"
"Murilo Mendes (born May 13, 1901 in Juiz de Fora, Minas Gerais, - died in Lisbon on August 13, 1975) was an exponent of Modernist poetry in Brazil .","(Murilo Mendes, place of death, Lisbon)"
"Nicolasa Valdés was of Basque descent, born in Santiago, the second daughter of Domingo de Valdés y González de Soberal and of Ana Francisca de Borja de la Carrera y Ureta .","(Nicolasa Vald%C3%A9s, place of death, Santiago)"
"`` Gilbert died at Oxford on 15 July 1694, and was buried in the chancel of St Aldate's .","(Thomas Gilbert, place of death, Oxford)"
"Leonetti died in 1979 in Houston, Texas, of cancer, at the age of 50 Gravestone name is ``Nicholas Tommy Leonetti'' .","(Tommy Leonetti, place of death, Houston)"
The Chicago-born Ruth Hartman emigrated to Canada in 1925 when she married Egmont Leo Frankel (d. 1964) .,"(Ruth Frankel, place of death, Toronto)"
"Norton was born in Lockport, Illinois, the son of John Lyman Norton and Ada Clara Gooding Norton .","(John W. Norton, place of death, Charleston)"
"In 1853 Clark had taken orders, but left the Church in 1870 after the passing of the Clerical Disabilities Act, of which he was one of the promoters .","(William George Clark, place of death, York)"
Louis Klein died 2 November 1845 in Paris .,"(Louis Klein, place of death, Paris)"
"Nelson was born in Copenhagen, Denmark, but emigrated to the United States the following year and he was raised in Hegewisch, a neighborhood on the far southeast side of Chicago .","(Battling Nelson, place of death, Chicago)"
"Hughes was elected as a Democrat to the 73rd Congress (March 4, 1933-January 3, 1935), but chose not to seek renomination in 1934, resuming a post as sales manager in De Pere, Wisconsin .","(James F. Hughes, place of death, Rochester)"
Jacques and Constance White were married in 1929 and had two sons and a daughter .,"(John Jacques, Baron Jacques, place of death, Portsmouth)"
"Young was elected as a Democrat to the Sixty-second and to the four succeeding Congresses (March 4, 1911-March 3, 1921) .","(James Young, place of death, Dallas)"
"Baron Von Stosch, after his death in Florence, was inhumated in the Old English Cemetery in Livorno, where his grave, still existing, is badly damaged .","(Philipp von Stosch, place of death, Florence)"
Spellman remained on the court until his death in 1991 in Miami .,"(Eugene P. Spellman, place of death, Miami)"
"Walsh's defeat led to a decline in his business fortunes, and he lost most of his previous wealth .","(Cornelius Walsh, place of death, Newark)"
"Henri Gascar (1635 -- 1 Jan 1701) (also Gascard, Gascars) was a French-born portrait painter who achieved artistic success in England during the reign of Charles II He painted many leading ladies at court, including several of the King's mistresses, before returning to Paris .","(Henri Gascar, place of death, Rome)"
Campbell died on 6 March 1924 in London where he had come for an operation .,"(Henry Campbell, place of death, London)"
Catherine was involved in many worthy causes including serving for many years as president of the Woman's Foreign Missionary Society of the Presbyterian Church .,"(Catherine Seaton Skirving, place of death, Toronto)"
"In her personal politics, Enid Lakeman was a lifelong activist in the Liberal Party (now Liberal Democrats) .","(Enid Lakeman, place of death, Kent)"
"Williams became the Bishop of Waiapu in 1895, following his late father's career as his father had been the first bishop .","(Leonard Williams, place of death, Napier)"
"Soon after receiving this last honourable testimony of high respect, Roxburgh returned to Edinburgh, where he later died .","(William Roxburgh, place of death, Edinburgh)"
"Trigland was professor of theology at the University of Leiden, succeeding André Rivet in 1633 .","(Jacobus Trigland, place of death, Leiden)"
"A mural monument was erected to his memory in Norwich Cathedral by his heir, James Sayers .","(Frank Sayers, place of death, Norwich)"
"Craven died of bronchitis at his home in south London on 22 July 1910, at the age of 73 Obituary tributes in the newspapers declared him to have been ``the greatest of English scene-painters, and perhaps the finest scene-painter who has ever lived'' (The Manchester Guardian), whose ``scenes were real pictures, with the atmosphere and charm of fine paintings'' (The Standard) .","(Hawes Craven, place of death, London)"
"Herschel H Hatch moved to Detroit in 1895 and practiced law until 1910, when he retired .","(Herschel H. Hatch, place of death, Detroit)"
"Khan died on 27 November 2011 in Mumbai, Maharashtra India after a prolonged illness .","(Sultan Khan, place of death, Mumbai)"
"Váli died on 19 November, 1984 in Massachusetts, U.S.A .","(Ferenc A. Váli, place of death, Massachusetts)"
Nini (née Ingrid Margaret Haslund) was born in Moss as the daughter of deputy education officer Johannes Emmanuel Haslund and Aagot Mathilde Løken .,"(Nini Haslund Gleditsch, place of death, Oslo)"
"Merrick was married six times, to Lenore Beck, Jeanne Gibson, Etan Aronson (twice), Karen Prunczik, and Natalie Lloyd .","(David Merrick, place of death, London)"
"Dinsmoor's main research focused on the propylaia to the acropolis in Athens, working to study its construction and establish its configuration during various phases .","(William Bell Dinsmoor, Jr., place of death, Athens)"
"Lucy Goodale was born on October 29, 1795, daughter of Abner Goodale, a Deacon in Marlborough, Massachusetts .","(Asa and Lucy Goodale Thurston, place of death, Honolulu)"
"Although based in Vienna Bianca Bianchi sometimes performed in other cities of the German and Austrian empires, notably Hamburg, Carlsruhe and Budapest .","(Bertha Schwarz, place of death, Salzburg)"
"Glover, on leaving school in his fourteenth year was apprenticed to business, when he was soon moved by religious impulses .","(John Glover, place of death, Norwich)"
Evelyn Suart was a President of the Society of Women Musicians .,"(Evelyn Suart, place of death, London)"
"In 1931, Pepe died of food poisoning at age 23 in Lisbon .","(Pepe Soares, place of death, Lisbon)"
Kann recovered only a small fraction of his large collection before his death in England in 1948 .,"(Alphonse Kann, place of death, England)"
"Alger died at Annapolis, Maryland, on February 23, 1912 .","(Philip Rounsevile Alger, place of death, Annapolis)"
"Václav Havel (October 5, 1920 -- December 14, 1979) was a Czechoslovak slalom and sprint canoer who competed from the late 1940s to the late 1950s .","(Václav Havel, place of death, Prague)"
"Lantsberg died on September 29, 2005 in Nuremberg after prolonged illness .","(Vladimir Lantsberg, place of death, Nuremberg)"
Soledad Bengoecha de Cármena (21 March 18491893) was a Spanish composer .,"(Soledad Bengoecha de C%C3%A1rmena, place of death, Madrid)"
"Reitman was born in St Paul, Minnesota to poor Russian Jewish immigrants in 1879, but grew up in Chicago .","(Ben Reitman, place of death, Chicago)"
"José de Cieza, the son and scholar of Miguel Geronimo de Cieza, was born at Granada in 1656 .","(José de Cieza, place of death, Madrid)"
"O'Brien died August 31, 2009, in a Knoxville hospital after suffering a fall two weeks earlier at her home in Crossville .","(Anna Belle Clement O'Brien, place of death, Knoxville)"
"Wells Coates died of a heart attack in Vancouver on June 17, 1958 at the age of 63 .","(Wells Coates, place of death, Vancouver)"
Won Alexander Cumyow died 1955 October 6 in Vancouver .,"(Won Alexander Cumyow, place of death, Vancouver)"
"After the war, Algirdas Klimaitis, moved to Hamburg, Germany, where he died in 1988 .","(Algirdas Klimaitis, place of death, Hamburg)"
Dermer did not return to Newfoundland but remained in New England as Gorges's employee .,"(Thomas Dermer, place of death, Virginia)"
"In mid-1873, Barrow's health declined, and though he went to the intercolonial conference at Sydney as one of the South Australian delegates in the hope that change of scene might lead to its improvement, it continued to deteriorate; he died in Adelaide on 22 August 1874 of an effusion on the brain .","(John Henry Barrow, place of death, Adelaide)"
"He died on 1 August 2000 in Mumbai, and on his first death anniversary in 2001, a book ``Ali Sardar Jafri: The youthful boatman'' of joy was released .","(Ali Sardar Jafri, place of death, Mumbai)"
"Faithfull supported the National Children's Bureau, of which she was president .","(Lucy Faithfull, Baroness Faithfull, place of death, London)"
John Maunsell died 20 January 1265 in Florence and was buried in York Minster .,"(John Maunsell, place of death, Florence)"
"His peerages became extinct, but his baronetcy was inherited by a distant cousin, Sir Annesley Stewart .","(William Stewart, 1st Earl of Blessington, place of death, London)"
"Following research for the government into infra-red radiation during World War II, Robert Jack retired in 1947 .","(Robert Jack, place of death, Dunedin)"
After the October Revolution Guchkov provided financial support for the White Guard .,"(Alexander Guchkov, place of death, Paris)"
"Vanik died in his sleep on August 30, 2007 at his home in Jupiter, Florida .","(Charles Vanik, place of death, Jupiter)"
"Coffeen was elected as a Democrat to the Fifty-third Congress, serving from March 4, 1893 to March 3, 1895; he was an unsuccessful candidate for reelection in 1894 to the Fifty-fourth Congress .","(Henry A. Coffeen, place of death, Sheridan)"
"Price was born in Hawthorn, South Australia; he died in Adelaide at the age of 58 .","(Walter Price, place of death, Adelaide)"
"Eugene Mallove was killed on May 14, 2004 in Norwich, Connecticut, while cleaning a recently vacated rental property owned by his parents, the home he grew up in The nature of Mallove's work led to some conspiracy theories regarding the homicide, but police suspected robbery as the motive .","(Eugene Mallove, place of death, Norwich)"
"Lawler died in 1831 in Cincinnati, Ohio, where he was buried at the Episcopal Burial Ground .","(Matthew Lawler, place of death, Cincinnati)"
Friedberg died of cancer in her Manhattan home .,"(Gertrude Friedberg, place of death, Manhattan)"
Mure also took part in the timber trade .,"(John Mure, place of death, Glasgow)"
"The violence of these polemics, the strain of overwork, and the death of Lope de Vega so affected Montalbán that he became insane; he died at Madrid on the 25th of June 1638 .","(Juan Pérez de Montalbán, place of death, Madrid)"
Willem Breuker died on 23 July 2010 in Amsterdam .,"(Willem Breuker, place of death, Amsterdam)"
Conradin died at Bologna in 1429 during a plague .,"(Conradin of Bornada, place of death, Bologna)"
"She was the daughter of Lewis Llewelyn Dillwyn, Liberal MP and owner of the Dillwyn Spelter Works at Swansea .","(Amy Dillwyn, place of death, Swansea)"
"James Black died on 22 June 1872 in Washington, Arkansas .","(James Black, place of death, Washington)"
John Scott died on 30 July 1992 in Auckland after a major heart operation .,"(John Scott, place of death, Auckland)"
"The film movement that emerged from the turmoil, characterised by Italian Neorealism, had little need of classical actors like Umberto Sclanizza, and, amidst persistent ill-health, he returned occasionally to theatre work before his death in Venice on 14 December 1951 .","(Umberto Sclanizza, place of death, Venice)"
Ermentrout was elected as a Democrat to the Forty-seventh and to the three succeeding Congresses .,"(Daniel Ermentrout, place of death, Reading)"
Flower died in 1861 at his home in Leicester .,"(John Flower, place of death, Leicester)"
"A native of the Częstochowa County village of Sygontka, Aleksy Ćwiakowski withdrew from politics in 1930 and, during the destruction of World War II and subsequent Communist takeover, was able to make his way to London, where he died in the year of his 68th birthday, 1953 .","(Aleksy Ćwiakowski, place of death, London)"
"Vaux died on March 22, 1895 in Philadelphia, where he is buried in Laurel Hill Cemetery .","(Richard Vaux, place of death, Philadelphia)"
"Brown died in 1936 in Woodstock, alone and impoverished but by no means unaccomplished .","(Bolton Brown, place of death, Woodstock)"
"He was married, and left a son, George Bourchier Richardson (d. 1877), who shared his father's tastes; he executed some of the woodcuts in the ''Table Book`` and the ''Reprints;`` lectured and wrote on local antiquities; and failing, after his father's emigration, to carry on his business with success, he followed him in 1854 to Australia .","(Moses Aaron Richardson, place of death, Adelaide)"
"Taken prisoner of war by Nazi Germany, Porwit spent the remainder of World War II in POW camps .","(Marian Porwit, place of death, Warsaw)"
"Hetzel died at age 73 on September 13, 2003 at his Squirrel Hill home in Pittsburgh and is buried at Homewood Cemetery .","(Frederick A. Hetzel, place of death, Pittsburgh)"
"Romola spent most of World War II in Budapest with Nijinsky, whose illness was in partial remission from the IST .","(Romola de Pulszky, place of death, London)"
Angioy guided the Sardinian Revolution (1794--1796) against the feudal privileges and laws that still existed on the island of Sardinia .,"(Giovanni Maria Angioy, place of death, France)"
"Robinson died on April 28, 2008 at Henry Ford Hospital in Detroit at the age of 96 For the remainder of the 2008 NBA Playoffs, the Pistons uniforms wore a black patch in his memory .","(Will Robinson, place of death, Detroit)"
"In 1717 Hemsterhuis was appointed professor of Greek at the University of Franeker, to replace Lambert Bos, but he did not enter on his duties there till 1720 .","(Tiberius Hemsterhuis, place of death, Leiden)"
In 1890 Aldous became the conductor of the Hamilton Philharmonic Society after the departure of Clarence Lucas .,"(J. E. P. Aldous, place of death, Hamilton)"
"Rick McNair (1942--2007), was a playwright, author, director, actor, storyteller, librettist, bibliophile, basketball player and coach .","(Rick McNair, place of death, Winnipeg)"
"Shortly after the publication of this last piece Breval died at Paris, January 1738 .","(John Durant Breval, place of death, Paris)"
"Gelman died in May 1970 in Israel, where he had returned later in life .","(Aaron Gelman, place of death, Israel)"
"He was a younger brother of Francis Mason, archdeacon of Norfolk, and was born at Wigan, Lancashire, about 1573 .","(Henry Mason, place of death, Wigan)"
"There is a portrait of the bishop, by Jamieson, at Birkhill, Fife, reproduced in The Wedderburn Book .","(James Wedderburn, place of death, Canterbury)"
Reynie died in 1709 in Paris .,"(Gabriel Nicolas de la Reynie, place of death, Paris)"
In 1857 Thomson was elected member for Geelong in the Victorian legislative assembly but retired in April 1859 .,"(Alexander Thomson, place of death, Geelong)"
"Edward Hay died at Dublin, 13 October 1826, and is buried in St James' graveyard, Kilmainham, Dublin, where his headstone can still be seen .","(Edward Hay, place of death, Dublin)"
"The tree Degeneria vitiensis, which he discovered in Fiji in 1942, is named after him .","(Otto Degener, place of death, Honolulu)"
"Henry Joseph O'Brien (July 21, 1896--July 23, 1976) was an American prelate of the Roman Catholic Church .","(Henry Joseph O'Brien, place of death, Hartford)"
"Johann Conrad Dorner, an Austrian painter, was born at Egg, near Bregenz, in 1810, and studied historical painting under Cornelius .","(Johann Conrad Dorner, place of death, Rome)"
"In the late war years, Foss began his study of Ralph Vaughan Williams, to which the composer himself contributed ``A Musical Autobiography'' .","(Hubert J. Foss, place of death, London)"
"Geraldine Hoff Doyle died on December 26, 2010 in Lansing, Michigan, due to complications from arthritis, aged 86 She is survived by her 5 children, 18 grandchildren and 25 great-grandchildren .","(Geraldine Doyle, place of death, Lansing)"
"Johnston was encouraged by Laud in his literary efforts, possibly as a strike against George Buchanan's reputation as a Latin poet .","(Arthur Johnston, place of death, Oxford)"
"Francis Adorno (1521 - January 13, 1586) was a celebrated Italian preacher .","(Francis Adorno, place of death, Genoa)"
"Frans de Momper, a Flemish landscape painter, who was a native of Antwerp, is inscribed in the ' Liggere' of the Guild of St Luke in that city in 1629-30 .","(Frans de Momper, place of death, Antwerp)"
"James Oneal died on December 12, 1962 in Seattle, Washington .","(James Oneal, place of death, Seattle)"
Lyman Andrews died Friday 13 February 2009 at his apartment in Nottingham .,"(Lyman Andrews, place of death, Nottingham)"
"He is buried in Greyfriars Kirkyard in Edinburgh, where he died in 1812, and a memorial to him stands there, having been erected by friends and well-wishers of the man who had gained fame during his lifetime as Donnchadh Bàn nan Òrain or ``Fair Duncan of the Songs'' .","(Duncan Ban MacIntyre, place of death, Edinburgh)"
"Harris died on October 2, 1994 in Birmingham, Alabama .","(Claude Harris, Jr., place of death, Birmingham)"
"Rabbi Waldenberg died on 21 November 2006 at Shaarei Zedek Medical Center in Jerusalem, of which he had been the Rabbi .","(Eliezer Waldenberg, place of death, Jerusalem)"
"David Croft died in his sleep on 27 September 2011, at his home in Portugal, twenty days after his 89th birthday .","(David Croft, place of death, Portugal)"
"Professor Lence was born in Whitefish, Montana on December 19, 1943 .","(Ross M. Lence, place of death, Houston)"
"Knott died at Southampton, Hampshire on 27 February 2003 .","(Charles Knott, place of death, Southampton)"
"Sarah Crompton was born in Birmingham, the daughter of J W Crompton, a merchant .","(Sarah Crompton, place of death, Birmingham)"
"Saunders died in 1947 in Toronto, Ontario where she had lived for a number of years .","(Margaret Marshall Saunders, place of death, Toronto)"
"In 1924, Collitz was elected the first president of the Linguistic Society of America .","(Hermann Collitz, place of death, Baltimore)"
"Gilbert died July 19, 1865 at his home in Boston .","(Timothy Gilbert, place of death, Boston)"
"Pearre was elected to the Maryland State Senate in 1890, and served until 1892 .","(George Alexander Pearre, place of death, Cumberland)"
"When she died at age 98 in Baltimore, Evans was one of the last surviving cast members of a W S Gilbert production and possibly the last surviving player in an original run of a Gilbert production .","(Amy Evans, place of death, Baltimore)"
"He died at Edinburgh on 7 June 1711; his intimate correspondent, Henry Dodwell the elder, died on the same day .","(John Sage, place of death, Edinburgh)"
