"After the war John Starr opened a night-club in Hanley, Staffordshire, in partnership with the brothers Alfred and Henry Newton, SOE agents whom he had met during his training and also at the Avenue Foch .","(John Renshaw Starr, place of death, Switzerland)"
Arroyo died at Madrid in 1551 .,"(Diego de Arroyo, place of death, Madrid)"
"Murakowski died in 1985 at age 60 at his home in Hammond, Indiana .","(Art Murakowski, place of death, Hammond)"
Belissen remained in Marseilles until his death .,"(Laurent Belissen, place of death, Marseille)"
Tournély died at Paris .,"(Honoré Tournély, place of death, Paris)"
"William J Bresnan died on November 27, 2009, at his home in Greenwich, Connecticut, from complications due to cancer at the age of 75 .","(William Bresnan, place of death, Greenwich)"
"Fred Rich died on September 8, 1956 in California aged 58 after a long illness .","(Fred Rich, place of death, California)"
"Varvara Massalitinova was designated People's Artist of Russia and was awarded for her performances on stage and in film (Stalin Prize, 1941) .","(Varvara Massalitinova, place of death, Moscow)"
Trevor Hall has argued that Gurney's death was suicide: Gordon Epperson argues against this hypothesis .,"(Edmund Gurney, place of death, Brighton)"
"Robert W Copeland died at Tacoma, Washington, on August 25, 1973 .","(Robert W. Copeland, place of death, Tacoma)"
"A year or two after Stothard died, Anna Eliza married Edward Atkyns Bray, the vicar of Tavistock .","(Anna Eliza Bray, place of death, London)"
Edmondson's career lasted for about fifteen years .,"(William Edmondson, place of death, Nashville)"
Ambassador Mark died in a car accident in 2005 at age 81 in Montana .,"(David E. Mark, place of death, Montana)"
"After the introduction of steel for engraving purposes about the year 1823, Cousins and his contemporaries were compelled to work on it, because the soft copper previously used for mezzotint plates did not yield a sufficient number of fine impressions to enable the method to compete commercially against line engraving, from which much larger editions were obtainable .","(Samuel Cousins, place of death, London)"
"On May 13, 1977, Spillane was killed outside his apartment in Queens .","(Mickey Spillane, place of death, Queens)"
"Uvedale Tomkins Price died at Bath in 1764 and was succeeded at Foxley by his grandson Uvedale Price, writer on the Picturesque .","(Uvedale Tomkins Price, place of death, Bath)"
"In 1920, Furse formed the Association of Wrens and this led to her becoming head of the Sea Rangers and for ten years, from 1928 to 1938, was director of the World Association of Girl Guides and Girl Scouts whose constitution she drafted .","(Katharine Furse, place of death, London)"
"Ogilvie was happier and made a much greater mark as principal of Jesus College, Oxford from 1944 until his death in 1949 .","(Frederick Ogilvie, place of death, Oxford)"
Orgeni became a voice teacher at the Dresden Royal Conservatory in 1886 .,"(Aglaja Orgeni, place of death, Vienna)"
"After the death of her father in 1741, Brita Sophia and her mother moved to Paris in France, where they converted to Catholicism .","(Brita Sophia De la Gardie, place of death, Paris)"
"Hersey was an unsuccessful candidate for Governor of Maine in 1870, losing by only 20 votes .","(Samuel F. Hersey, place of death, Bangor)"
Sandberg served as the director of the Academy from 1845 to 1853 .,"(Johan Gustaf Sandberg, place of death, Stockholm)"
"In 1848, Greenleaf retired from his active duties, and became professor emeritus .","(Simon Greenleaf, place of death, Cambridge)"
"Marta Canales Pizarro (17 July 1893 -- 6 December 1986) was a Chilean violinist, choral conductor and composer .","(Marta Canales, place of death, Santiago)"
"Le Fevre was elected as a Republican to the Seventy-eighth and to the three succeeding Congresses, holding office from January 3, 1943 to January 3, 1951; he was not a candidate for renomination in 1950 and resumed his merchandising interests .","(Jay Le Fevre, place of death, Kingston)"
"A new Byzantine invasion of Thessaly occurred in 1277, but was repelled at Pharsalos by John .","(John I Doukas of Thessaly, place of death, Constantinople)"
"Falconer married Frances, daughter of Lieutenant-colonel Robert Raitt, by whom he had issue, besides one son and three daughters who died in his lifetime, four sons who survived him, viz .","(Thomas Falconer, place of death, Bath)"
"Tobias Andreae, who was born at Frankfort in 1823, studied under J Becker, and then went to Munich, where he made the acquaintance of Rahl and Genelli .","(Tobias Andreae, place of death, Munich)"
Adele Marcus died on 3 May 1995 at her home in Manhattan .,"(Adele Marcus, place of death, Manhattan)"
Andy Schuttinger began winding down his racing operations in 1952 and retired from the business .,"(Andy Schuttinger, place of death, Florida)"
"Sanders died of a heart attack on August 18, 1997 at his home in Potomac .","(Frank P. Sanders, place of death, Potomac)"
"In August 1993, Amon Bazira was assassinated in Kenya at Nakuru, allegedly with the complicity of Tiny Rowland, Yoweri Museveni and Daniel arap Moi .","(Amon Bazira, place of death, Kenya)"
Meadmore died at the age of 76 in Manhattan from complications of Parkinson's disease .,"(Clement Meadmore, place of death, Manhattan)"
Allen died of a heart attack in Montreal in 1935 and was buried in the Beechwood Cemetery .,"(John J. Allen, place of death, Montreal)"
"Johnston's later years were passed mainly at his residence (much later known as Orleans House) Twickenham, and he died at Bath in May 1737, see the separate article .","(Archibald Johnston, place of death, Bath)"
"She died in Boston on February 16, 1994 of smoke inhalation from a fire at the Ann Wigmore Foundation .","(Ann Wigmore, place of death, Boston)"
"Crisp died at her home in Phoenix, Arizona .","(Mary D. Crisp, place of death, Phoenix)"
"For many years he had a sports shop in Sunderland trading as Willie Watson Sports, and he died in Sunderland in 2009 .","(Albert Watson, place of death, Sunderland)"
"Masquerier still painted occasionally after his retirement; in 1831 he exhibited ''A Marriage in the Church of St Germain l'Auxerrois, Paris,`` and in 1838 ''Buonaparte and Marie Louise viewing the Tomb of Charles the Bold at Bruges .","(John James Masquerier, place of death, Brighton)"
"Lewin died on December 18, 2010, at the age of 84 in Hawaii .","(Donn Lewin, place of death, Hawaii)"
"Captain Bonser died just over a year later, on December 26, 1913 at Providence St Vincent Medical Center in Portland .","(John Bonser, place of death, Portland)"
Hi Jolly became a living legend until his death in Arizona .,"(Hi Jolly, place of death, Arizona)"
"A native of Copenhagen, Rasch emigrated to Canada where he died in Vancouver in 1988 .","(Bent Peder Rasch, place of death, Vancouver)"
"Givens died on December 8, 2009 at his home in Louisville, Kentucky .","(John Givens, place of death, Louisville)"
"Aubrey Hornsby died in 1981 in Montgomery, Alabama .","(Aubrey Hornsby, place of death, Montgomery)"
"On starting his managerial career, Siddons aimed at producing plays with greater efficiency in all directions than before, at the Edinburgh Theatre; he was encouraged and supported by Scott .","(Henry Siddons, place of death, Edinburgh)"
"Phillips died at Philadelphia, Pennsylvania, on January 29, 1803 .","(Jonas Phillips, place of death, Philadelphia)"
"Bardsley was born at Nottingham on 7 July, 1801 .","(James Lomax Bardsley, place of death, Manchester)"
"This settlement, that was successfully established by some of the ``old planters'', became Salem, Massachusetts and, in Conant's words, laid the ``foundation'' for the Commonwealth .","(Roger Conant, place of death, Beverly)"
"Mira Ashby, CM was the founder of Ashby House, opened in 1978 .","(Mira Ashby, place of death, Toronto)"
Following her retirement Brema became director of the opera class at the Royal Manchester College of Music .,"(Marie Brema, place of death, Manchester)"
"General Stack died at Calais, France, in December 1833 .","(Edward Stack, place of death, Calais)"
"Chais died on September 26, 2010 at age 84 in Manhattan, where he and his wife had moved to further the treatment of a blood disorder that eventually took his life .","(Stanley Chais, place of death, Manhattan)"
"Long died at home in Portsmouth on April 13, 1789 and is buried in the Proprietor's Burying Ground there .","(Pierse Long, place of death, Portsmouth)"
Cawton died at Rotterdam on 7 August 1659 .,"(Thomas Cawton, place of death, Rotterdam)"
"In addition to Formula One, Walt Hansgen was a dominant road racer from the early 1950s and 1960s, winning numerous races at VIR (Virginia International Raceway), the famed course at Bridgehampton, and Watkins Glen through to his death at Le Mans in France in 1966 .","(Walt Hansgen, place of death, France)"
"Sir Benjamin d'Urban's remains now rest at the Last Post Fund National Field of Honour, a military cemetery owned by the Last Post Fund in Pointe-Claire where there is an obelisk to his memory .","(Benjamin d'Urban, place of death, Montreal)"
Having returned to England Sir Ralph became secretary of state in March 1614 and a member of parliament .,"(Ralph Winwood, place of death, London)"
John Petrie died on 8 December 1892 in Brisbane and is buried with his wife and family in Toowong Cemetery .,"(John Petrie, place of death, Brisbane)"
Odofredus died at Bologna in 1265 .,"(Odofredus, place of death, Bologna)"
"In time, Baraga became renowned throughout Europe for his work .","(Frederic Baraga, place of death, Marquette)"
Sanchez retired to Miami where he died of cancer in 1987 .,"(Jorge Noceda Sanchez, place of death, Miami)"
"Suffering from emphysema and asthma after a lengthy illness, Johnny PayCheck died at Nashville's Vanderbilt University Medical Center in 2003 .","(Johnny Paycheck, place of death, Nashville)"
"John Tombs was son of a banker, Joseph Tombs (1745--1818), of Abingdon .","(John Tombs, place of death, Malta)"
"Bishop Joyce died on 28 July 1905 in Minneapolis, Minnesota and is buried in Lakewood Cemetery of that city .","(Isaac Wilson Joyce, place of death, Minneapolis)"
"Hussey died at the age of 38 in London and was buried at Caythorpe where his estate was valued at about £2,500 p.a .","(Sir Charles Hussey, 1st Baronet, place of death, London)"
"Arthur Thompson was born in Milan, Minnesota in 1891; his father was a harness maker .","(Arthur E. Thompson, place of death, Minnesota)"
"He married, 13 January 1783, Lucy, daughter of Thomas Thoresby of Leeds, and left several children, of whom one, Robert Nowell Whitaker, succeeded him at Whalley vicarage .","(Thomas Dunham Whitaker, place of death, Blackburn)"
Guarini wrote portions of the Corpus Inscriptionum Latinarum on Campania and Samnium .,"(Raimondo Guarini, place of death, Naples)"
"Frank Marion died in 1963 in Stamford, Connecticut .","(Frank J. Marion, place of death, Stamford)"
"Having suffered attacks of jaundice throughout her life, Frances Burney died in 1828 in Bath .","(Frances Burney, place of death, Bath)"
"Squibb died on October 25, 1900, at his home in Brooklyn, New York, from a ruptured blood vessel .","(E. R. Squibb, place of death, Brooklyn)"
"Stall died of complications from pulmonary disease on November 2, 2008 at his home in Sacramento, California .","(Bill Stall, place of death, Sacramento)"
Anastas Jovanović (1817--1899) was the first Serbian photographer of his time to treat photography as an art form and to capture on film historical events as they were happening .,"(Anastas Jovanović, place of death, Belgrade)"
"After the sale of Erol's Internet to RCN, Onaran retired from business, leaving his family to run the electronics business which was not included in the deal .","(Erol Onaran, place of death, Turkey)"
"In the late 1860s, Doniphan re-opened his law office in Richmond, Missouri, where he died at the age of 79 He is buried in Fairview Cemetery in Liberty under an obelisk .","(Alexander William Doniphan, place of death, Richmond)"
"In 1905 Nuttall went to the United States, joined the staff of the New York Herald, and contributed to Life, The Century, Harper's, and other periodicals .","(Charles Nuttall, place of death, Melbourne)"
"Samuel Joseph May died on July 1, 1871 in Syracuse, New York, donating over 10,000 of his own titles to the Cornell Library .","(Samuel Joseph May, place of death, Syracuse)"
"From 1877 until her retirement from the stage in 1880, Haupt was committed to the opera house in Mainz .","(Marie Haupt, place of death, Leipzig)"
"After a lifetime of speaking out on behalf of unions and social welfare issues, Florence Reece died of a heart attack in 1986 at the age of 86 in Knoxville, Tennessee .","(Florence Reece, place of death, Knoxville)"
"Cannon died on January 28, 1782 in Philadelphia .","(James Cannon, place of death, Philadelphia)"
See also David Mitchell David Mitchel was a 17th century Scottish churchman .,"(David Mitchel, place of death, Aberdeen)"
Van Osdel died at age 80 in Chicago .,"(John M. Van Osdel, place of death, Chicago)"
On metallurgical subjects also he was an acknowledged authority; and he published observations on the order of sulphurability of metals (loi de Fournet) .,"(Joseph Jean-Baptiste Xavier Fournet, place of death, Lyon)"
Crane died at Prescott in 1858 .,"(Samuel Crane, place of death, Prescott)"
"Mattingly died in 1951 in Louisville, Kentucky .","(Sylvan Mattingly, place of death, Louisville)"
"Johann Stephan Decker, a French painter, was born at Colmar in 1784 .","(Johann Stephan Decker, place of death, Vienna)"
"Having become senator for the département of Doubs (1895--1902), Rambaud held the position of minister of Public Instruction from April 29, 1896 to June 28, 1898, and in that capacity endeavoured to carry on the educational work of Jules Ferry, to whose memory he always remained faithful .","(Alfred Nicolas Rambaud, place of death, Paris)"
"Giuseppe Agnelli was a Roman Catholic author, chiefly known for his catechetical and devotional works, b at Naples, 1621; d in Rome, 17 October 1706 .","(Giuseppe Agnelli, place of death, Rome)"
Geoffrey and his wife Ivetta had five sons .,"(Geoffrey le Scrope, place of death, Ghent)"
"Grumet died on June 7, 1987 at Beth Israel Hospital in Manhattan at the age of 86 .","(Jacob B. Grumet, place of death, Manhattan)"
"Marcon abandoned cricket after he left Oxford to become a vicar in Cornwall and eventually the Rector of Edgefield in his native Norfolk, where he died in 1875 .","(Walter Marcon, place of death, Norfolk)"
"During his literary career, Dygasiński wrote several short stories and novels .","(Adolf Dygasiński, place of death, Warsaw)"
"Anthony Johnson Showalter died September 14, 1924 in Chattanooga, Tennessee and is buried in the West Hill Cemetery of Dalton, Georgia .","(Anthony Johnson Showalter, place of death, Chattanooga)"
"Giovan Battista Dell'Era, an Italian historical painter, was born at Treviglio in 1766 .","(Giovan Battista Dell'Era, place of death, Florence)"
Galbraith was elected as a Jacksonian to the Twenty-third and Twenty-fourth Congresses .,"(John Galbraith, place of death, Erie)"
"Durando became senator of Sardinia (later, Kingdom of Italy) in 1860 .","(Giovanni Durando, place of death, Florence)"
Reed was elected as a Whig to the Twenty-eighth Congress .,"(Charles Manning Reed, place of death, Erie)"
Emery's collections of Hymenoptera are in Museo Civico di Storia Naturale di Genova .,"(Carlo Emery, place of death, Bologna)"
Daley died in a Bangor jail cell while under arrest for another crime in 1910 .,"(Michael Daley, place of death, Bangor)"
"President Lyndon B Johnson nominated Dyer to the United States Court of Appeals for the Fifth Circuit on August 16, 1966, to a seat vacated by Warren Leroy Jones .","(David W. Dyer, place of death, Miami)"
In 1998 Merlino died at the Forrestal Nursing and Rehabilitation Center in Princeton at the age of 76 .,"(Joseph P. Merlino, place of death, Princeton)"
Margaret died twenty-two years after her husband .,"(Margaret of England, place of death, Belgium)"
"Richard Nolte died of complications from a stroke at his home in Hanover, New Hampshire, on November 22, 2007 .","(Richard Nolte, place of death, Hanover)"
"From 1900, Mrs Craigie lived and worked at her villa near her parents' home at Steephill, Isle of Wight .","(John Oliver Hobbes, place of death, London)"
"Born in London and educated at Emanuel School, Banting was initially attracted to vorticism and associated with the Bloomsbury Group, before becoming interested in surrealism in Paris in the 1930s .","(John Banting, place of death, Hastings)"
"Wilmot became physician in ordinary to George III in 1760, left London next year, and lived in Nottingham; but then moved to Heringstone in Dorset, where he died on 21 November 1786 .","(Sir Edward Wilmot, 1st Baronet, place of death, Dorset)"
Christina Bellin died of a brain tumor at her Manhattan home in 1988 .,"(Christina Bellin, place of death, Manhattan)"
Gray was chairman of the executive of the Liberal Party organization for six years and was a member of the Council of the Liberal Party at the time of his death .,"(Milner Gray, place of death, Hertfordshire)"
Childs died at Philadelphia on the 3rd of February 1894 .,"(George William Childs, place of death, Philadelphia)"
"Thomas Kelso (1784--1878) was born in Clonis, Ireland, August 28, 1784 .","(Thomas Kelso, place of death, Baltimore)"
"After his congressional service, Ray resided in both Byron, Georgia and Alexandria, Virginia .","(Richard Ray, place of death, Macon)"
"Harold Schafer died December 2, 2001, in a Bismarck hospital after an extended illness .","(Harold Schafer, place of death, Bismarck)"
Piotrowski returned to Bulgaria in 1889: he visited Batak and painted his epic canvas The Batak Massacre .,"(Antoni Piotrowski, place of death, Warsaw)"
"Hughes' ashes were spread in the Menai Straits after his death in Colchester, Essex .","(Hugh Iorys Hughes, place of death, Colchester)"
"She was married to Eliot Ness, an American Treasury agent, famous for his efforts to enforce Prohibition in Chicago, Illinois as the leader of a legendary team nicknamed The Untouchables .","(Evaline Ness, place of death, Kingston)"
Ridley died on 25 November 1887 in London and was survived by two daughters .,"(John Ridley, place of death, London)"
"Rafael Pombo remained in Colombia until his death on May 5, 1912 .","(Rafael Pombo, place of death, Colombia)"
"Manning died on March 10, 1986 in Arizona .","(Reg Manning, place of death, Arizona)"
"Harold Spiro died on 11 December 1996 in Cyprus, where he was buried .","(Harold Spiro, place of death, Cyprus)"
"Peterson died of natural causes at his home in Concord, North Carolina .","(Steve Peterson, place of death, Concord)"
"His wife, Frances Jeanne Higley, died June 3, 1989 in Dublin, OH Newsom died February 3, 1990 in Dublin, Dublin .","(Carroll Vincent Newsom, place of death, Dublin)"
"Following the demise of Lubin Studios in 1917, Romaine Fielding was out of filmmaking until 1920 after which he continued to work in film until his death in Hollywood at the age of fifty-nine from a blood clot .","(Romaine Fielding, place of death, Hollywood)"
"Rita died February 1, 2004 in Houston at age 82 .","(Rita Gallagher, place of death, Houston)"
"From 1802 until 1815 Forsström was assigned as pastor on Saint Barthélemy of the Leeward Islands, where he also worked collecting botanical specimens .","(Johan Erik Forsström, place of death, Sweden)"
In 1827 Dighton was born to Isaac and Nancy Corson in Maine .,"(Dighton Corson, place of death, Pierre)"
"Lansbury died of cancer in the United States on 3 April 1991, aged 61, at her home in Philadelphia, Pennsylvania .","(Coral Lansbury, place of death, Philadelphia)"
Willson died at Lincoln on 8 September 1854 .,"(Edward James Willson, place of death, Lincoln)"
Swartz was elected as a Republican to the Sixty-ninth Congress .,"(Joshua William Swartz, place of death, Harrisburg)"
"Lloyd recorded many albums of English folk music, most notably several albums of the Child Ballads with Ewan MacColl .","(A. L. Lloyd, place of death, Greenwich)"
"Lipkowska escaped from the Soviet Union with her then husband Pierre Bodin in 1920, arriving in New York on the Adriatic of the White Star Line on February 8 In September of 1920, Lipkowska sang Gilda in Rigoletto with the San Carlo Opera Company in Manhattan .","(Lidiya Lipkovskaya, place of death, Beirut)"
"After his tenure in Congress, Henry continued the practice of law until his death in Cambridge .","(Daniel Maynadier Henry, place of death, Cambridge)"
"Pilkington's contribution to Rapin de Thoyras' Impartial History (1784) has been described as, ``an extreme falsification of his life.'' He died in 1774 in Dublin .","(Matthew Pilkington, place of death, Dublin)"
"Sir Grahame Clark, an archeologist and authority on prehistoric Europe, died on Tuesday at his home in Cambridge, England .","(Grahame Clark, place of death, Cambridge)"
"Hansson published his first works, Dikter (``Poems'') in 1884 and Notturno in 1885 .","(Ola Hansson, place of death, Turkey)"
"Studholme died at her home in London in March 1930 from a short but virulent attack of rheumatic fever, at the age of 57, and was buried in the St Marylebone Cemetery in East Finchley, survived by her second husband and children .","(Marie Studholme, place of death, London)"
"Elton was a man of cultivated tastes, who was friends with Charles Lamb and Samuel Taylor Coleridge .","(Charles Abraham Elton, place of death, Bath)"
"Mariana Grajales Coello died on November 27, 1893 in Kingston, Jamaica at the age of 85 .","(Mariana Grajales Cuello, place of death, Kingston)"
"On May 20, 2007, Guram Sharadze was assassinated on Melikishvili Avenue in central Tbilisi in front of the Aldagi Insurance Company office by Giorgi Barateli, an erstwhile friend of his son .","(Guram Sharadze, place of death, Tbilisi)"
"He was the younger brother of the better-known Alexander Runciman, and accompanied him to Naples, where he died .","(John Runciman, place of death, Naples)"
Virginia Proctor Powell Florence died in 1991 at the age of 93 in Richmond .,"(Virginia Proctor Powell Florence, place of death, Richmond)"
"In 1822, with his health in decline, Cristall went to Goodrich on the Wye, where he had already bought a house, and where he spent many happy years until the loss of his wife, who died in 1840, drove him again to London, where he died in 1847 .","(Joshua Cristall, place of death, London)"
"Rowland Brotherhood (senior) died at his home in Bristol on 4 March 1883, and is buried there in Arnos Vale Cemetery .","(Rowland Brotherhood, place of death, Bristol)"
"A Conservative, the Honourable John Ross served until his death in 1871 in Toronto, Ontario .","(John Ross, place of death, Toronto)"
Hortense Ellis died in her sleep in a Kingston hospital on 18 October 2000 from a stomach infection .,"(Hortense Ellis, place of death, Kingston)"
"Caruso died in 1921 at the age of 48, and Benjamin died the next year at the age of 74 at his summer home in Stamford, CT All of his children except Dorothy, still in Italy and living the high-life on Caruso's money, were at his bedside when he died .","(Park Benjamin, Jr., place of death, Stamford)"
"Sarah Morgan Bryan Piatt (August 11, 1836 -- December 22, 1919) an American poet born in Lexington, Kentucky to Talbot Nelson Bryan and Mary Spiers .","(Sarah Morgan Bryan Piatt, place of death, Caldwell)"
Smith died on 26 February 1832 in London .,"(Robert Cross Smith, place of death, London)"
"In the 1990s, Adler developed an interest in Russian thought and literature .","(Eve Adler, place of death, Russia)"
"Your friend, Sir, and my much--loved Nephew, Arthur Hallam, is no more--it has pleased God to remove him from this his first scene of Existence, to that better world for which he was Created .","(Arthur Hallam, place of death, Vienna)"
"After returning to the Athabasca District in 1905, Constantine was responsible for building a trail from Fort St John, British Columbia to Teslin Lake in the Yukon, although work on the trail was abandoned in 1908 .","(Charles Constantine, place of death, California)"
"Robie was elected as a Democrat to the Thirty-second Congress (March 4, 1851 -- March 3, 1853) .","(Reuben Robie, place of death, Bath)"
"Olof Arenius, a Swedish portrait painter, and son of a minister in Upland, was born in 1701 .","(Olof Arenius, place of death, Stockholm)"
"Colin John McRae (October 22, 1812--1877) was a prominent Confederate politician .","(Colin John McRae, place of death, Belize)"
"After some work in Constantinople, and while waiting for his equipments and tents to proceed to the interior of Asia Minor, Yeardley was smitten with paralysis at Isnik, and was compelled to return to England, where he died on 11 August 1858 .","(John Yeardley, place of death, England)"
"Mauritz Hallgren died November 10, 1956 in Baltimore, Maryland .","(Mauritz A. Hallgren, place of death, Baltimore)"
John Joseph Cotman (1814--1878) was an English landscape painter .,"(John Joseph Cotman, place of death, Norwich)"
"Ward died at Brighton, unmarried but was rumored to have had an out of wedlock son born in 1856 named Edward Terry Ward .","(Edward Ward, 4th Viscount Bangor, place of death, Brighton)"
Gagnier began his career as a trumpeter in the Canadian Grenadier Guards Band which was conducted by his uncle J.-J .,"(Gérald Gagnier, place of death, Montreal)"
"His family consisted of his wife, Eliza Douglas Monroe (1799--1852), son William D Monroe, and daughter Fanny (1826--1906) .","(James Monroe, place of death, Orange)"
Müller died on 11 May 1943 in Berlin .,"(Richard Müller, place of death, Berlin)"
Ruellan married fellow painter John W Taylor in 1929 .,"(Andr%C3%A9e Ruellan, place of death, Kingston)"
